[
  {
    "word": "it",
    "pos": "noun",
    "inflections": {
      "plural": "its",
      "possessive": "it's"
    },
    "pos_frequency": 0.002,
    "meanings": []
  },
  {
    "word": "are",
    "pos": "noun",
    "inflections": {
      "plural": "ares",
      "possessive": "are's"
    },
    "pos_frequency": 0.001,
    "meanings": []
  },
  {
    "word": "may",
    "pos": "noun",
    "inflections": {
      "plural": "Mays",
      "possessive": "May's"
    },
    "pos_frequency": 0.15,
    "meanings": [
      {
        "id": 1,
        "definition": "the fifth month of the year, between April and June",
        "domain": [
          "general"
        ],
        "register": "neutral",
        "countability": {
          "type": "UC",
          "special": false
        },
        "semantic_category": "time period",
        "emoji": "\ud83d\udcc5",
        "collocations": {
          "adjective_noun": [
            "early May",
            "late May",
            "last May"
          ],
          "noun_verb": [
            "May arrives",
            "May brings",
            "May ends"
          ]
        },
        "synonyms": [
          "springtime",
          "spring month"
        ],
        "examples": [
          "The wedding is scheduled for May.",
          "May brings warmer weather and flowers.",
          "We always vacation in early May."
        ]
      }
    ]
  },
  {
    "word": "school",
    "pos": "noun",
    "inflections": {
      "plural": "schools",
      "possessive": "school's"
    },
    "pos_frequency": 0.95,
    "meanings": [
      {
        "id": 1,
        "definition": "a place where children and young people receive education",
        "domain": [
          "education",
          "general"
        ],
        "register": "neutral",
        "countability": {
          "type": "C",
          "special": false
        },
        "semantic_category": "educational institution",
        "emoji": "\ud83c\udfeb",
        "collocations": {
          "adjective_noun": [
            "elementary school",
            "high school",
            "public school",
            "private school"
          ],
          "noun_verb": [
            "school starts",
            "school ends",
            "school teaches",
            "school provides"
          ]
        },
        "synonyms": [
          "institution",
          "academy",
          "educational facility"
        ],
        "examples": [
          "She walks to school every morning.",
          "The school has over 500 students.",
          "Our school offers many after-class activities."
        ]
      },
      {
        "id": 2,
        "definition": "the time during which teaching happens at a school",
        "domain": [
          "education"
        ],
        "register": "neutral",
        "countability": {
          "type": "UC",
          "special": false
        },
        "semantic_category": "time period",
        "emoji": "\u23f0",
        "collocations": {
          "adjective_noun": [
            "after school",
            "before school",
            "during school"
          ],
          "noun_verb": [
            "school begins",
            "school finishes",
            "school resumes"
          ]
        },
        "synonyms": [
          "class time",
          "school hours"
        ],
        "examples": [
          "School starts at eight o'clock sharp.",
          "No phones allowed during school.",
          "She has piano lessons after school."
        ]
      },
      {
        "id": 3,
        "definition": "a group of people who share similar ideas or methods",
        "domain": [
          "arts",
          "philosophy",
          "academic"
        ],
        "register": "formal",
        "countability": {
          "type": "C",
          "special": false
        },
        "semantic_category": "intellectual group",
        "emoji": "\ud83c\udfa8",
        "collocations": {
          "adjective_noun": [
            "old school",
            "new school",
            "philosophical school"
          ],
          "noun_verb": [
            "school emerges",
            "school influences",
            "school develops"
          ]
        },
        "synonyms": [
          "movement",
          "tradition",
          "approach"
        ],
        "examples": [
          "The impressionist school changed art forever.",
          "He belongs to the old school of thought.",
          "Different schools of economics offer various theories."
        ]
      }
    ]
  },
  {
    "word": "years",
    "pos": "noun",
    "inflections": {
      "plural": "years",
      "possessive": "years'"
    },
    "pos_frequency": 0.98,
    "meanings": [
      {
        "id": 1,
        "definition": "plural of year; multiple periods of twelve months",
        "domain": [
          "general"
        ],
        "register": "neutral",
        "countability": {
          "type": "C",
          "special": false
        },
        "semantic_category": "time period",
        "emoji": "\ud83d\udcc6",
        "collocations": {
          "adjective_noun": [
            "many years",
            "several years",
            "recent years",
            "early years"
          ],
          "noun_verb": [
            "years pass",
            "years go by",
            "years fly",
            "years bring"
          ]
        },
        "synonyms": [
          "ages",
          "decades",
          "time"
        ],
        "examples": [
          "She lived there for twenty years.",
          "Years of practice made him expert.",
          "In recent years, technology has advanced rapidly."
        ]
      }
    ]
  },
  {
    "word": "season",
    "pos": "noun",
    "inflections": {
      "plural": "seasons",
      "possessive": "season's"
    },
    "pos_frequency": 0.92,
    "meanings": [
      {
        "id": 1,
        "definition": "one of the four periods of the year: spring, summer, fall, winter",
        "domain": [
          "general",
          "geography"
        ],
        "register": "neutral",
        "countability": {
          "type": "C",
          "special": false
        },
        "semantic_category": "time period",
        "emoji": "\ud83c\udf42",
        "collocations": {
          "adjective_noun": [
            "rainy season",
            "dry season",
            "holiday season",
            "busy season"
          ],
          "noun_verb": [
            "season changes",
            "season begins",
            "season ends",
            "season brings"
          ]
        },
        "synonyms": [
          "time of year",
          "period",
          "quarter"
        ],
        "examples": [
          "Fall is my favorite season.",
          "The rainy season starts in June.",
          "Each season brings different weather patterns."
        ]
      },
      {
        "id": 2,
        "definition": "a period when a particular sport or activity happens",
        "domain": [
          "sports",
          "arts"
        ],
        "register": "neutral",
        "countability": {
          "type": "C",
          "special": false
        },
        "semantic_category": "activity period",
        "emoji": "\u26bd",
        "collocations": {
          "adjective_noun": [
            "football season",
            "baseball season",
            "hunting season",
            "theater season"
          ],
          "noun_verb": [
            "season starts",
            "season opens",
            "season closes",
            "season continues"
          ]
        },
        "synonyms": [
          "period",
          "time",
          "schedule"
        ],
        "examples": [
          "Basketball season runs from October to April.",
          "The theater season features ten new plays.",
          "Hunting season opens next Monday."
        ]
      }
    ]
  },
  {
    "word": "world",
    "pos": "noun",
    "inflections": {
      "plural": "worlds",
      "possessive": "world's"
    },
    "pos_frequency": 0.96,
    "meanings": [
      {
        "id": 1,
        "definition": "the earth and all the people and things on it",
        "domain": [
          "general"
        ],
        "register": "neutral",
        "countability": {
          "type": "C",
          "special": true
        },
        "semantic_category": "planet",
        "emoji": "\ud83c\udf0d",
        "collocations": {
          "adjective_noun": [
            "whole world",
            "entire world",
            "modern world",
            "real world"
          ],
          "noun_verb": [
            "world changes",
            "world needs",
            "world watches",
            "world waits"
          ]
        },
        "synonyms": [
          "earth",
          "globe",
          "planet"
        ],
        "examples": [
          "She wants to travel the world.",
          "The whole world watched the event.",
          "Climate change affects the entire world."
        ]
      },
      {
        "id": 2,
        "definition": "a particular area of activity or group of people",
        "domain": [
          "general",
          "social"
        ],
        "register": "neutral",
        "countability": {
          "type": "C",
          "special": false
        },
        "semantic_category": "domain",
        "emoji": "\ud83c\udfad",
        "collocations": {
          "adjective_noun": [
            "business world",
            "fashion world",
            "academic world",
            "digital world"
          ],
          "noun_verb": [
            "world revolves",
            "world operates",
            "world functions",
            "world exists"
          ]
        },
        "synonyms": [
          "realm",
          "sphere",
          "domain"
        ],
        "examples": [
          "He's famous in the art world.",
          "The business world is highly competitive.",